"app","source","text","score","timestamp","username"
"reddit","reddit","trabajo remoto pago de impuestos resuelto hola gente bella hace dos dias vine haciendo una pregunta en el sub sobre si declarar impuestos ya que trabajo remoto para una empresa extranjera gracias todos los que comentaron quiero decirles que fui dos entidades mi banco el mismisimo sar dio miedo pues pasa que tengo un conocido en el sar le hice la pregunta fuimos la oficina del sar ahi explicaron por qué los trabajadores remotos estamos obligados declarar impuestos como ustedes saben la ley en honduras se contradice exagerado si bien somos obligados tributarios en este caso el isr aplica nosotros por esto mi banco explico que mi empresa paga directamente mi cuetna sino que pagan atravez de un intermediario en este caso un banco en el extranjero dicho banco tiene la informacion tributaria concepto del pago ej cualquier banco extranjero que ustedes usen plataformas como payoneer deel etc dicho banco paga atravez de mi banco hondureño omito nombres por seguridad asique mi banco puede registrar esa transaccion como ingresos por servicios pago internacional en el sar explicaron que puesto que mi empresa esta constituida en el extrenjero es considerada renta de fuente extranjera por ende yo tengo que declarar mis impuestos ya que en honduras se cobra renta territorial ya que es dinero que entra desde el extranjero como un ingreso exterior termina ayudando la economia nacional ya que aumenta la cantidad de dolares que se perciben en honduras como las remesas por ejemplo fuente si la necesitan httpswwwsefingobhnwpcontentuploadstexto_consolidado_codigo_tributario_junio_y_anexospdfhttpswwwsefingobhnwpcontentuploadstexto_consolidado_codigo_tributario_junio_y_anexospdf si bien estoy obligado pagar isr aconsejaron extender estados de cuenta en mi banco para que sirvan para fines bancarios crediticios migratorios en fin gente una vez mas si trabajan remoto bajo la ley actual estan obligados pagar isr menos que se pase una reforma tributaria que cambie esto de momento estamos seguros de nuevo gracias gente bella suerte en todo",180,"2025-05-15 00:18:14","Traditional_View2105"
"reddit","reddit","hiring vakantiehulp kerstafdeling avri bloem en tuincentrum avri bloem en tuincentrum hiring vakantiehulp kerstafdeling location oosteind netherlands description kijk jij het hele jaar uit naar kerst ben jij creatief en deel je jouw enthousiasme kerst graag lijkt het je leuk om onderdeel te zijn van ons gezellige team terwijl je lekker bijverdient de vakantie word dan onze nieuwe vakantiehulp op de kerstafdeling door jou ziet onze kerstshow er spectaculair uit met liefde verwerk je alle binnenkomende kerstproducten met de prijstang de hand sta je klaar om alle kerstartikelen uit te pakken en te prijzen ook kan je ingezet worden om het kerstteam te ondersteunen met het opbouwen van de kerstshow alle schappen moeten natuurlijk gevuld worden maar ook voor het schilderen van een wandje draai jij je hand niet om en er een keer hulp nodig op een andere afdeling van ons tuincentrum dan vind jij het alleen maar leuk om te helpen wat neem jij mee heb je eerder een winkel gewerkt dan dat mooi meegenomen maar het niet vereist wel vinden het belangrijk dat je affinit learn apply httpsappresumesetcomjobsvakantiehulpkerstafdeling",1,"2025-05-15 00:03:13","josylad"
"reddit","reddit","soms voel ik sterk soms voel ik leeg beide versies van mij verdienen liefde moederschap leerde mij dat je niet altijd hoeft te shinen om waardevol te zijn soms je aanwezigheid al genoeg moeder vrouw leider van mijn eigen verhaal wat herken jij deze woorden ben jij jezelf kwijtgeraakt een rol en beetje bij beetje terug aan het komen deel je gevoel je vraag gewoon een knikje van herkenning",1,"2025-05-14 23:05:09","byPriscillaMK"
"reddit","reddit","job boards roi indeed linkedin obvious job boards curious anyone would recommend spending moneytime posting others hire mostly remote roles usbased employees far looked following mom project either annual membership fee direct placement fee salary flexjobs different pricing tiers employers starting per month citing special running currently seeing complaints candidate end redditt need pay membership thrilled quality price work remotely per job starting seems highly regarded job seeker perspective justremote days posting wellfound job board early stage companies free post lot international candidates come unfortunately cannot hire anyone experience particularly ones need pay speak roi boards missing job boards pull indeed anyway duplicate work make sense use none sponsor indeed gotten nonreferral hires historically thanks",0,"2025-05-14 22:49:34","Inevitable-Zebra-308"
"reddit","reddit","counterfeit copy ordered spanish edition seller ebay arrived today riddled typos checked isbn number barcode seems legit far many typos trust im worried actually getting way reading anyone encountered something similar another bolaño book typos include errors spacing random apostrophes misspelled words page numbers dont make sense see pictures",14,"2025-05-14 22:33:15","Pleasant-Bug5554"
"reddit","reddit","advice improving hand writing consistency issue ive several years want improve hand writing style every style ive tried never felt comfortable hand advice would appreciated im med school",2,"2025-05-14 22:27:40","superunatura"
"reddit","reddit","wordt intens erg gewaardeerd kan eventueel ruilen tegen efteling zegels",1,"2025-05-14 22:16:47","ariacasillas"
"reddit","reddit","ik zwijg niet langer een analyse omdat er veel gezegd werd en omdat ik soms graag eens diep duik een onderwerp heb ik een paar uur van mijn leven besteed aan het analyseren van die ene video van dvl weet je niet waar het gaat bespaar u dan de moeite ik zal beginnen met een paar toegevingen en kanttekeningen ik voeg onderaan een lijst toe met de bronnen waaruit mijn informatie komt mijn tijd en middelen zijn beperkt ik heb véél opgezocht en gelezen maar ik kan niet alles opzoeken en lezen wat er dit proces te vinden valt ja het lijkt erop dat het gerecht zaken beter kunnen doen welkom de wereld overal zitten mensen die fouten maken zelfs onbekwaam zijn helaas ook bij de overheid en haar instanties vooralsnog lijken de advocaten van van langenhove geen gerechtelijke stappen te ondernemen tegen die zaken die ze aanklagen hun betogen willen ze dat doen hebben ze daar het recht en de middelen toe ik schrijf dit zo objectief mogelijk zoals elke mens heb ik mijn meningen en vooroordelen ik ben daar echter bijzonder bewust van en doe mijn uiterste best om objectief en met open geest naar de informatie te kijken en enkel naar de informatie de zaak interessanter en genuanceerder dan ik dacht daarmee doel ik vooral op de inhoud van het proces en de precieze beschuldigingen en vooral op de beschuldigingen aan het adres van de andere svleden alles wordt complexer en minder zwartwit hoe meer je erover te weten komt ook hier ik heb geen zicht op de gerechtelijke documenten die lijken niet publiek toegankelijk te zijn via openbare bronnen wellicht kan dat via een aanvraag bij de instanties maar daar heb ik geen tijd voor noch zin ik ben ondertussen héél moe en hoop dat hier geen fouten zijn geslopen dat wel zo laat het mij alstublieft weten nog een bemerking voor de opsomming begint het heel fijn dat schild vrienden begonnen als groep die positieve acties opzet zoals het opruimen van afval en het helpen bij goede doelen dat wist ik niet en het jammer dat ze daar niet bij konden blijven overdrijven beledigen een compilatie slaag ik erin veel te snel veel te veel machtige vijanden te maken impliceren van een complot en dus oneerlijke vervolging zonder bewijs linkse journalisten die uit zijn op mijn bloed overdrijven en de tegenpartij bestempelen als gevaarlijk als je huiszoekingen hebt gehad waarbij je hele privé aan de vijand wordt doorgegeven impliceren van een complot door het woord vijand zaak werd toevallig toevallig toebedeeld aan een communistische rechter impliceren van een complot en rechters met een verborgen agenda kan maar dan moet je met meer dan een beschuldiging komen journalisten vlaanderen die zijn te dom te kwaadwillig om het vonnis te lezen schelden bij gebrek aan argumenten vermeldingen van het belgische regime afschilderen van de staat als een dictatuur oneerlijke manipulatieve valse uitspraken het heel jammer dat dvl zijn video één adem met die hierboven vermelde goede acties ook protesten tegen lockdowns opsomt wie niet meer weet dat die lockdowns nodig waren mag de doden hier eens vergelijken met bvb het dodenaantal de vs nog vreemder dat er voor die lockdownprotesten hulp werd ingeroepen van een zwitserse organisatie die hun thuisland bestempeld worden als neonazistisch en waar ondertussen ook rechtszaken tegen lopen dvl beweert herhaaldelijk dat er slechts posts problematisch bleken mits het nodige knip en plakwerk de reportage van pano die nog steeds beschikbaar en de vele artikelen die er ondertussen geschreven zijn bevatten echter een veelvoud aan voorbeelden van aanstootgevende berichten dat zijn inderdaad geen posts de betekenis van facebookposts maar dat semantiek hier probeert hij de feiten te minimaliseren te banaliseren dvl haalt aan dat het gaat om berichten van meer dan jaar geleden op het moment van de feiten de beschuldigingen waren die natuurlijk wél nog heel recent en relevant hier probeert hij te doen alsof het allemaal al héél lang geleden ik er altijd alles aan gedaan heb om geen grove dingen toe te laten dit een grove leugen de discord server stond vol grove uitspraken het feit dat dvl na kennisneming van de reportage opriep om het bezwarende materiaal te verwijderen zegt ook genoeg onderzoeksrechter moet objectief blijven maar noemde mij een ranzige fascist dit klopt niet eens volgens zijn eigen screenshot waarop je het volgende kan lezen waar ranzig normaal wordt fascistisch banaal wordt dat kan gaan de discord sv maar niet dries zelf waar verwijst immers niet naar een persoon niks illegaal gevonden bij de huiszoekingen volgens het openbaar ministerie werd er een berg aan materiaal gevonden bij de huiszoeking dat gaat dan om de vele berichten en memes en dat materiaal werd voldoende geacht om een veroordeling uit te spreken onder de racisme en negationismewetgeving het materiaal dan illegaal het gedrag waarvan ze deel uitmaken dat lijkt een semantische discussie er werden wel degelijk zaken gevonden dvl het er gewoon niet mee eens wat die zaken betekenen grove memes hadden eruit gemoeten en dan hadden ze echt niks meer om tegen ons te gebruiken vals er waren ook de beschuldigingen van overtreding van de wapenwet dvl beweert dat de rechters niet naar de bewijzen het dossier hebben gekeken maar wel naar pano dat overdrijven dat liegen kiest u zelf maar procureur des konings meldt dat er geen aanwijzingen zijn om hem te vervolgen wegens ontkennen etc van de holocaust moeilijk om dit soort documenten na te kijken maar feit dat die beslissing van de raadkamer beroep vernietigd wordt dat vertelt dvl zelf ook en hij alsnog wordt doorverwezen dvl noemt dat ondanks het feit dat er geen bewijs maar dat volgens de kamer van inbeschuldigingstelling dus mogelijk wel het geval dvl haalt aan dat er ergens het vonnis staat dat er geen negationistische uitspraken etc rechtstreeks aan hem te linken zijn rechtstreeks doet wat werk die zin maar los daarvan heeft de rechtbank klaarblijkelijk ook zwaar getild aan zijn functie als de facto leider van de groep die het gebeuren dus ofwel gedoogde ofwel aanmoedigde vermoedelijk het tweede als men de vele artikels erover leest maar enkel het vonnis dat ik niet heb kan dat uitsluiten dvl klaagt zijn spreekverbod alsof hem onterecht het zwijgen wordt opgelegd terwijl een spreekverbod de inhoud van een lopend gerechtelijk onderzoek behoudens via de advocaat wat ook voor hem gold heel normaal hij insinueert hier dat hij op voorhand al gestraft onwettelijk beperkt werd zijn vrijheden de rechtbank zou driemaal geweigerd hebben een getuige te horen als dit vc gaat dan het manipulatief verwoord want die weigert zelf om te komen getuigen de meeste mensen ook ik tot voor kort weten niet dat horen hier betekent dat de rechtbank die persoon verplicht te komen getuigen dvl beweert dat de de zittingsdag waarin hij eindelijk zijn verhaal zou kunnen doen werd afgeschaft dit kan ik niet controleren maar hij heeft wel bijna uur mogen spreken op het einde van het proces nu klaagt hij dat hij zichzelf niet heeft kunnen verdedigen want daar hij à uur voor nodig daarom doet dvl alsof hij zich niet heeft kunnen verdedigen terwijl dat net de taak van zijn advocaat en die heeft daar héél veel tijd voor gehad voor iemand die vaak klaagt een vermeend gebrek aan bewijs beweert dvl zelf heel wat zaken zonder dat te staven met bewijsmateriaal zaken die volgens dvl incorrectillegaal waren aan de kant van de aanklager journalisten zaken waarmee zijn advocaat wel weg moeten weten als ze inderdaad waar waren dvl beweert dat de grove memes uit het dossier moesten omdat ze op illegale manier via hacking van een minderjarige werden verkregen ze hebben jaar tijd gehad om daar klacht voor neer te leggen bewijs werd vervalst bewijsstukken verdwenen werden verwisseld dvl beweert dat antwoorden op vragen gesteld door de onderzoeksrechter zijn privé werden doorgespeeld aan de media en dat noemt hij strafbaar en bewijs van corruptie gehoopt dat ik eindelijk van die loodzware rechtszaak vervolgd hij bedoelt verlost zou zijn dat ik eindelijk bij mijn kinderen ging kunnen zijn bij mijn gezin terug kunnen sporten de tuin kunnen werken dvl doet alsof hij al jaar vast zit dit zielig doen om sympathie te winnen en dat manipulatief andere problemen met het betoog van dvl hij vraagt de kijker om na net geen minuten monoloog verder te klikken op een videoreeks waarin hij nog dieper detail gaat alsof dat allemaal objectief en correct gaat zijn hij vraagt geld om zijn gevecht te steunen niet de video meen ik mij toch niet te herinneren maar wel de beschrijving ervan dvl vraagt dat naar zijn acties kijken niet naar wat men hem zegt oké een greep uit het aanbod dat mijn mening kleurt protesteren tegen de lockdown terwijl die werkte een video posten waarin hij brugge een winkel binnenstapt om de pridevlag die buiten aan de winkel hangt een pedofielenvlag te noemen beweren insinueren dat het afmaken van zijn masteropleiding hem verboden werd dat niet zo zijn toegang tot de gebouwen sterk beperkt maar hij kon zijn thesis afmaken proberen om de berichten op discord te verwijderen bewijzen verwijderen dus een detective sturen achter iemand die hij wil laten getuigen ontkennen dat een alternatieve facebookaccount van hem terwijl het bewijs daarvan er beweren dat dries op discord niet hijzelf terwijl dat bewijs er het liveverslag van het proces eerste bron tekent een bizar beeld van de verdediging van dvl meester rieder lijkt vooral bezig met lastminute aanpassingen en vragen tot uitstel en weinig met het weerleggen van de tenlasteleggingen dat kan een vertekend beeld zijn door een beperkte selectie aan info daarvan ben ik bewust tldr er geen tldr dit niet samen te vatten een paar zinnen rechtszaken zijn complex bronnen httpswwwdemorgenbesnelnieuwsliveprocesschildvriendenzittingafgelopenvanlangenhovenaiefomtegelovendatikeeneerlijkekanszoukrijgenbdcehttpswwwdemorgenbesnelnieuwsliveprocesschildvriendenzittingafgelopenvanlangenhovenaiefomtegelovendatikeeneerlijkekanszoukrijgenbdce httpswwwdemorgenbenieuwsschildvriendenorganiseerdecoronaprotestinkortrijksamenmetzwitserseneonazisbdeffhttpswwwdemorgenbenieuwsschildvriendenorganiseerdecoronaprotestinkortrijksamenmetzwitserseneonazisbdeff httpswwwbruzzbesamenlevingorganisatorencoronabetoginghebbenbandenmetextreemrechtshttpswwwbruzzbesamenlevingorganisatorencoronabetoginghebbenbandenmetextreemrechts httpswwwnieuwsbladbecntdmf_httpswwwnieuwsbladbecntdmf_ httpswwwnieuwsbladbecntdmf_httpswwwnieuwsbladbecntdmf_ httpswwwdemorgenbenieuwshoedepaniektoesloegbijschildvriendenikmoetdatwetenikkandaarvoorvervolgdwordenhebahttpswwwdemorgenbenieuwshoedepaniektoesloegbijschildvriendenikmoetdatwetenikkandaarvoorvervolgdwordenheba httpswwwvrtbevrtnwsnlintimidatieenbedreigingenalsschrikeffectvooralwiekritischttpswwwvrtbevrtnwsnlintimidatieenbedreigingenalsschrikeffectvooralwiekritisc httpswwwvrtbevrtnwsnlwaaromvanlangenhovesverdedigingweinigaannemelijkishttpswwwvrtbevrtnwsnlwaaromvanlangenhovesverdedigingweinigaannemelijkis httpswwwvrtbevrtnwsnlzaakdriesvanlangenhovehttpswwwvrtbevrtnwsnlzaakdriesvanlangenhove",111,"2025-05-14 21:03:48","Zizinge"
"reddit","reddit","human ai force ai agents sell support scale business worlds first ai workforce creator deploy lifelike human ai agents sell support scale business seconds human ai force worlds first app builds lifelike ai professionals seconds work coaching marketing lead gen sales customer service affiliate marketing hr mentoring one click sell whitelabel ai workforces service fiverr upwork freelancer peopleperhour toptal legit charge per clients fastest figure passive income",1,"2025-05-14 19:48:40","Agreeable_Income3763"
"reddit","reddit","uitgaan je eentje het een beetje gebruikelijk nederland om je eentje uit te gaan een beetje context jarige man een grote stad als amsterdam rotterdam een studentenstad als nijmegen utrecht het ongemakkelijk creepy juist laagdrempelig en goed te doen kan je ook een beetje verwachten dat je wat praatjes sociale interacties maakt niet perse met vrouwen eventueel vrienden als je een ervaring mening hebt deel het graag",3,"2025-05-14 19:36:46","HappyShopkeeper"
"reddit","reddit","company wants hire contractor another eu country shady normal germany hey im currently based germany another country eu company wants hire employee instead want make contract freelancer pitch ill get benefit paying taxes social security yay unpaid labor brought fact scheinselbstständigkeit illegal germany could create problems us even suggested using something like deel could employ properly across borders said theyd consult lawyer first setup kind normal home country know things different even legal id still end paying everything employer normally would pension health insurance etc im wondering shady actually kind common germany expats working similar freelancestyle contracts germany push somehow align german work culture law agree later finanzamt says legit would one trouble",4,"2025-05-14 19:12:09","Lybchikfreed"
"reddit","reddit","rank megaforce comparison gi joe live action films think seeing vehicles actually built cool would rather watch cartoon looks like poster thats feel",86,"2025-05-14 17:51:24","torklugnutz"
"reddit","reddit","slang tuinsproeier ondergronds verstopt hoi allemaal ik hoop dat jullie kunnen helpen ik heb mijn tuin pop upsproeiers sproeiers doen het niet meer ik heb de koppen eraf gehaald de hele sproeier eraf en nog steeds nadaa als ik de kraan opendraai loopt er heel even water en dan stopt het als ik de slang loskoppel van de kraan schiet er onder hoge druk water uit zelfs met het uiteinde open dus ergens zit er iets verstopt en uiteraardhelaas liggen deze slangen deels onder een terras nu zat ik te denken aan een ontstoppersveer maar die zijn vaak maar meter lang en dan het ook nog maar de vraag zoiets wel geschikt wil de slang niet lekprikken ik dacht ook aan een mengsel van sodaazijn een middel maar ik ben bang dat je daarmee de slang kapot maakt en hoe krijg je dat door de hele slang heen misschien zou een optie een compressor zijn onder hoge druk water erdoor maar ben bang dat die slang dan gaat lekken ik ben een beetje ten einde raad hebben jullie goede tips ideeënoplossingen ik ben een beetje radeloos",1,"2025-05-14 17:42:40","Appeltaartlekker"
"reddit","reddit","deel vs hire e ser br contratado para trabalhar na gringa olá pessoal passei em um processo seletivo para trabalhar na gringa e rh perguntou se estava tudo bem por mim ser contratado pela hire em vez da deel pelo tempo de espera notebook na deel seriam semanas mais mas em relação às empresas qual diferença se tiver dicas sobre como não cair em pegadinhas ou questões específicas de contrato gringo mano pf responde aqui embaixo",5,"2025-05-14 17:26:32","PhysicalCycle7333"
"reddit","reddit","deel vs hire e ser br contratado para trabalhar na gringa olá pessoal passei em um processo seletivo para trabalhar na gringa e rh perguntou se estava tudo bem por mim ser contratado pela hire em vez da deel pelo tempo de espera notebook na deel seriam semanas mais mas em relação às empresas qual diferença se tiver dicas sobre como não cair em pegadinhas ou questões específicas de contrato gringo mano pf responde aqui embaixo",1,"2025-05-14 17:25:56","PhysicalCycle7333"
"reddit","reddit","deel vs hire e ser br contradado para trabalhar na gringa olá pessoal passei em um processo seletivo para trabalhar na gringa e rh perguntou se estava tudo bem por mim ser contratado pela hire em vez da deel pelo tempo de espera notebook na deel seriam semanas mais mas em relação às empresas qual diferença se tiver dicas sobre como não cair em pegadinhas ou questões específicas de contrato gringo mano pf responde aqui embaixo",1,"2025-05-14 17:24:30","PhysicalCycle7333"
"reddit","reddit","masteronderzoek particuliere verhuurders hi ik doe momenteel onderzoek naar particuliere verhuurders nederland ik probeer inzicht te creëren de wensen en behoeftes van particuliere verhuurders omtrent verduurzaming dus ben jij een particuliere verhuurder vul dan graag mijn vragenlijst httpspsychruqualtricscomjfeformsv_egreyotivohttpspsychruqualtricscomjfeformsv_egreyotivo ken je iemand die particulier verhuurder deel deze vragenlijst met hen",2,"2025-05-14 17:12:49","Vinzuenet"
"reddit","reddit","wat betekent werk écht voor jou deel jouw kijk een interview ben jij de afgelopen tot jaar opnieuw aan het werk gegaan na een burnout voor mijn masterthesis onderzoek ik hoe mensen hun kijk op werkwaarden wat je belangrijk vindt je werk ervaren na een periode van uitval wat houdt het een éénmalig interview van ongeveer min uur online op locatie en volledig vertrouwelijk jouw verhaal helpt om beter te begrijpen wat mensen nodig hebben om duurzaam aan het werk te blijven interesse stuur gerust een berichtje",1,"2025-05-14 16:48:44","Consistent-Worry7531"
"reddit","reddit","discovering belgium two wheels epic brommer vlog adventure hallo allemaal deze vlog neem ik jullie mee op een scooter avontuur op deze mooie dinsdag mei het weer perfect en ik heb zin om even naar buiten te gaan ik ga een paar boodschappen doen en deel mijn gedachten de dag en wat er morgen op de planning staat ook bespreek ik het belang van het bijhouden van mijn uitgaven kijk mee en geniet van de rit vergeet niet te liken en te abonneren",1,"2025-05-14 16:40:24","goudoogdragon1"
"reddit","reddit","discovering belgium two wheels epic brommer vlog adventure hallo allemaal deze vlog neem ik jullie mee op een scooter avontuur op deze mooie dinsdag mei het weer perfect en ik heb zin om even naar buiten te gaan ik ga een paar boodschappen doen en deel mijn gedachten de dag en wat er morgen op de planning staat ook bespreek ik het belang van het bijhouden van mijn uitgaven kijk mee en geniet van de rit vergeet niet te liken en te abonneren",1,"2025-05-14 16:27:38","goudoogdragon1"
"reddit","reddit","algún buen banco para tener cuenta siendo contractor el próximo mes voy cambiar de trabajo paso de estar en relación de dependencia ser contractor van pagar por deel pero voy dejar de tener la cuenta sueldo en mi banco bbva quería preguntar si hay algún banco que ofrezca bonificaciones buenos beneficios para alguien que cobre de afuera si voy tener que pagar mantenimiento sí sí la idea es hacer monotributo facturar siempre así que traigan apps falopas ni cripto",3,"2025-05-14 16:19:31","Matiaslb"
"reddit","reddit","im thinking start work freelancer shelll scrippting realistically market adding title im thinking home sites like upwork fiverr freelancercomhttpfreelancercom toptal peopleperhour working organization isnt option moment portfolio show lets say scripts purposes kind shallow show context id guess theyre scripts help daytoday flow code fine purebash performancesensitive scripts purpose anyway guys say thats issue find projects engage good way learn anyway never enough thankfully rush start working ive solely linux around years improving switching portfolio huge deal",6,"2025-05-14 15:22:14","lucasrizzini"
"reddit","reddit","bouwen iets voor mensen die graag delen jouw input telt hoi allemaal ik ben een klein onderzoekje aan het doen hoe mensen spullen met elkaar delen zoals gereedschap keukentoestellen tuinmateriaal het onderdeel van shareit een lokaal project waarmee het makkelijker willen maken om dingen uit te lenen te lenen van je buren denk aan een soort platform waar je veilig en snel kan delen met mensen je buurt zowel privé met vrienden familie als openbaar je wijk als je minuten tijd hebt om een korte vragenlijst te vullen help je ons enorm httpsformtypeformcomtowrethchttpsformtypeformcomtowrethc problemen met laden schakel even je vpn uit probeer een andere browser alle antwoorden zijn anoniem en ik deel graag de resultaten achteraf de groep alvast heel erg bedankt erland ps wil je graag het verhaal achter shareit lezen built shareit community platform realworld sharinghttpsmediumcompefcbcdb",2,"2025-05-14 15:02:32","erlandvr"
