"app","source","text","score","timestamp","username"
"reddit","reddit","strategie verkoop tussenwoning hoi ik sta op het punt mijn tussenwoning te verkopen omdat ik een ander huis heb gekocht de woning instapklaar en sinds veel nieuw vernieuwd denk aan badkamer keuken deels vloerverwarming begane grond pvc vloer uitbouw meter nieuwe schuifpui en kozijnen hr allen en de tuin opgehoofd en nieuw aangelegd er ook een overkapping geplaatst vorig jaar heb ik met wat makelaars gesproken de evt verkoopprijs en daar waren alle makelaars eens dat het huis euro waard dat oktober nu heb ik een makelaar gekozen en hij wil na al die maanden nog steeds de woning verkopen voor ton ik heb een goed gesprek met de makelaar gehad en hij zegt dat hij echt denk dat er euro voor kunnen krijgen andere makelaars denken ook zo rond die koers alleen hij gooit laag de markt zodat er meer mensen op af komen ik snap zijn gedachtegang natuurlijk zelf dacht ik om de woning gewoon voor k de verkoop te zetten dan wordt er minder overboden maar als er wordt geboden dan weet je dat je dat wel waarschijnlijk kan krijgen ipv risico dat het maar k wordt bijv gevoelsmatig maakt het mij weinig uit ik het voor ton verkoop dat er bij wijze van k wordt geboden k en er wordt k overboden het gevoel blijft hetzelfde ohja ik woon ook een wijk waar veel erfpacht van alle woningen totaal die nu te koop staan zou dit de enige woning zijn met volledig eigen grond mijn vraag wat zou je zelf doen wat zijn de eigen ervaringen hierin de woning heeft slaapkamers op de eerste verdieping en een e op de e verdieping en ik ben ergens bang dat dat niet erg aantrekt zeg maar om zó erg te overbieden terwijl er veel luxe dingen de woning zijn zoals een amerikaanse koelkast quooker aquacell douchewc kastinkast etc eerlijk ik ben gewoon zenuwachtig en onzeker dus vandaar mijn vraag dank alvast allen",3,"2025-05-16 20:35:35","Thin-Muffin4496"
"reddit","reddit","je gelooft nooit wat deze ereader kan je gelooft nooit wat deze ereader kan ideaal voor professionals eink technologie cloud sync en lange batterijduur wat denken jullie deel je mening httpsitinsightsnlhetlaatsteitnieuwsjegelooftnooitwatdezeereaderkan",1,"2025-05-16 20:31:12","itinsightsNL"
"reddit","reddit","ai onthult schokkende geheimen die je niet mag weten ai onthult geheimen die je niet mag weten wat zijn de ethische uitdagingen van ai deel je gedachten en discussieer mee ai discussie httpsitinsightsnlhetlaatsteitnieuwsaionthultschokkendegeheimendiejenietmagweten",1,"2025-05-16 19:01:20","itinsightsNL"
"reddit","reddit","airevolutie onthuld zoho onthult geheim voor bedrijfssucces zohos geheim voor bedrijfssucces met ai onthuld wat vinden jullie hiervan kan ai echt het verschil maken deel je gedachten ai discussion httpsitinsightsnlzakelijkeitairevolutieonthuldzohoonthultgeheimvoorbedrijfssucces",1,"2025-05-16 19:00:48","itinsightsNL"
"reddit","reddit","help een masterstudent aan de rug korte vragenlijst cvbeoordeling min hoi allemaal voor mijn masteronderzoek work organizational psychology aan de rijksuniversiteit groningen doe ik onderzoek naar cvscreening en onbewuste oordelen ik zoek nog deelnemers die een korte vragenlijst willen invullen duurt ongeveer minuten je ziet oa een paar cvs en maakt keuzes gebaseerd op je indruk alles volledig anoniem en wordt alleen voor dit onderzoek gebruikt leeftijd taal nederlands anoniem ja duur minuten klik hier om deel te nemenhttpsrugeuqualtricscomjfeformsv_jufjhmckiuy elke invulling helpt enorm ik zit de laatste fase van mijn onderzoek en heb nog respondenten nodig delen mag natuurlijk ook dank je wel voor je hulp",0,"2025-05-16 18:54:05","Sure-Hope-2436"
"reddit","reddit","german model us picked apple tv goodwill realize got home appears german model im us extra us power cord back says v hz sounds like would work wanted ask anyone knew sure accidentally fry thing plugging",1,"2025-05-16 18:42:10","Undisputedtruth3"
"reddit","reddit","diors digitale nachtmerrie hackers stelen exclusieve klantgeheimen dior gehackt klantgegevens gestolen wat betekent dit voor de luxeindustrie hoe veilig zijn onze gegevens deel je mening httpsitinsightsnlcybersecuritydiorsdigitalenachtmerriehackersstelenexclusieveklantgeheimen",1,"2025-05-16 17:31:11","itinsightsNL"
"reddit","reddit","zuidkoreas bancaire geheim onthult miljoenendeal voor spaarders zuidkorea verdubbelt depositogarantie wat denken jullie dit de juiste stap voor financiële stabiliteit deel je mening economie discussie httpsitinsightsnlanalyseszuidkoreasbancairegeheimonthultmiljoenendealvoorspaarders",1,"2025-05-16 17:30:35","itinsightsNL"
"reddit","reddit","hedendaags verwijzend naar recent nieuws zoals een flink deel van de opgaven de kruiswoordtests letters antwoord httpswwwpuzzelwoordenboeknucomhedendaagsverwijzendnaarrecentnieuwszoalseenflinkdeelvandeopgavenindekruiswoordtestslettershttpswwwpuzzelwoordenboeknucomhedendaagsverwijzendnaarrecentnieuwszoalseenflinkdeelvandeopgavenindekruiswoordtestsletters",1,"2025-05-16 17:29:25","riddleman01"
"reddit","reddit","ben je op zoek naar enquêtes met veel surveycirclepunten dan het het meest zinvol om deel te nemen aan enquêtes uit de survey ranking httpswwwsurveycirclecomsurveyshttpswwwsurveycirclecomsurveys hierdoor klim je sneller omhoog de survey ranking en zal je steekproef sneller groeien tip van het team gebruik de survey ranking op surveycirclecomhttpsurveycirclecom om efficiënt punten te verzamelen directe ondersteuning natuurlijk alleen mogelijk onze groepen httpspreviewreddittcqjoefgzepngwidthformatpngautowebpseacbaffaacfaab",1,"2025-05-16 17:02:32","surveycircle"
"reddit","reddit","het bijna regelloze weekenddraadje week het weekend het heerlijk om even te ontspannen daarom gelden dit draadje praktisch geen regels alleen die met betrekking tot goed fatsoen deel bespreek alles wat je maar wil met andere fireenthousiastelingen _deze post onderdeel van ons vaste schema van terugkerende onderwerpenhttpswwwredditcomrdutchfirewikiterugkerende_posts_",2,"2025-05-16 17:01:22","AutoModerator"
"reddit","reddit","mijn ervaring met ctrlf recruitment agency maandenlange stilte en geen opvolging ik wil graag mijn ervaring delen met ctrlf een rekruteringsbureau dat zich richt op profielen finance en engineering ik kan enkel spreken de financeafdeling want daar heb ik op meerdere vacatures gesolliciteerd een periode van maanden helaas kreeg ik geen enkele reactie ook niet na lange tijd wachten omdat ik dacht dat er iets mis gegaan heb ik ook hun contactformulier ingevuld maar daarop kwam geen enkele reactie na veel zoeken vond ik een telefoonnummer en nam ik zelf contact op daar werd ik weinig serieus genomen en kreeg ik geen duidelijke uitleg opvolging ik voelde dus volledig genegeerd ondanks meerdere pogingen om contact te komen toen ik aanvankelijk een verkeerd nummer kwam ik per toeval bij de engineeringafdeling terecht zij waren wel vriendelijk en behulpzaam maar konden verder niet helpen omdat ik bij finance moest zijn het dus niet het hele bureau dat ik één kam wil scheren maar mijn ervaring met ctrlf finance bijzonder teleurstellend als werkzoekende verwacht je minstens een antwoord wanneer je moeite doet om correct te solliciteren ctrlf finance liet mij compleet het ongewisse daarom deel ik dit hier voor andere werkzoekenden wees gewaarschuwd en verlies geen tijd voor bedrijven als je waarde hecht aan een professioneel imago denk goed na voor je samenwerkt met een bureau dat sollicitanten zo behandelt zijn er anderen met gelijkaardige ervaringen",1,"2025-05-16 16:42:12","No_Bird_9859"
"reddit","reddit","revolutionaire samenwerking onthult geheime itkennisbom wat vinden jullie van de samenwerking tussen heliview en insights deze combinatie belooft een schat aan itkennis en netwerkvoordelen deel je gedachten link httpsitinsightsnlzakelijkeitrevolutionairesamenwerkingonthultgeheimeitkennisbom",1,"2025-05-16 16:01:16","itinsightsNL"
"reddit","reddit","budget helm euro ik ben opzoek naar een nieuwe helm ter vervanging van mijn huidige ixs ik zoek iets onder de euro ivm budget daarnaast ben ik van mening dat dure helmen niet hun geld waard zijn ik koop liever elke jaar een nieuwe helm dan dat ik jaar met een helm van euro moet doen daarnaast rijd ik best wel weinig te weinig om een dure helm te verantwoorden ieder geval ik kon alleen deze prijsklasse veel helmen tegen en heb van een groot deel al wat reviews op youtube gezien gelezen maar daar kan ik eigenlijk niet veel uit opmaken integraal helmen ls ff euro nexx core goede ventilatie mtr fiber scorpion evo scorpion exo reviews niet echt geweldig hjc fq mcsf louis geen ruimte voor mijn com setje ivm kapjes aan de zijkant review slechte ventilatie shark ridill veel lawaai hjc cn slechte review brildrager caberg avalon x kira slechte review brildrager shark dskwal review slechte ventilatie systeem helmen exo evo euro louis dit zit ik het lijstje een beetje aan te vullen maar ik ben ook wel benieuwd naar andere meningen en ik de hjc c schijnt ook voor het budget een vrij goede helm te zijn bv toevallig nog een modelletje gemist de hjc c schijnt ook voor het budget een vrij goede helm te zijn bv eisen wat ik heb zijn mogelijkheid mijn eigen headsetje aan de zijkant te monteren zonnevizier goede ventilatie ik heb het snel warm ruimte de helm voor de speakertjes van mn headset geschikt zijn voor brildrager rijd met oordopjes dus geluid minder een issue",0,"2025-05-16 15:57:07","Tidder_18"
"reddit","reddit","dries de rechtbank deel",0,"2025-05-16 15:26:13","ultraprogressiefje"
"reddit","reddit","dries de rechtbank deel dries van langenhove mocht zijn verhaal nooit doen de media en ook de rechtbank werd hij de mond gesnoerd hij richt zijn repliek dus rechtstreeks aan u de videoreeks dries de rechtbank deel bespreekt de context aan de hand van een tijdlijn vanaf de uitzending van de panoreportage schild vrienden tot en met de rechtszaak voor het hof van beroep",0,"2025-05-16 15:25:49","ultraprogressiefje"
"reddit","reddit","top full stack development experts world full stack mean full stack development means working frontend clientside backend serverside web application frontend user interfaces including buttons layout animations etc backend databases apis authentication servers business logic full stack developer anyone manage roles thats like calling oneperson tech team whichlets honestmost folks dont actually operate way full stack development demand versatility rapid prototypin costeffective problem solvers backenddevelopmentcompanyhttpswwwbackenddevelopmentcompanycom company overview specializes backend architecture full stack development offering secure scalable highperforming applications across industries location india usa pricing hr employees hirebackenddeveloperhttpswwwhirebackenddevelopercom company overview leading name backend full stack developer hiring known rapid onboarding tailored tech stacks location india uk pricing hr employees hourlydeveloperiohttphourlydeveloperio company overview offers dedicated full stack developers hourly basis expertise modern web technologies like react nodejs angular location india uae pricing hr employees hirefrontenddeveloperindia company overview known delivering stunning uiux solutions full stack capabilities especially react vue angular location india pricing hr employees frontend development company company overview combines visual brilliance robust backend infrastructure deliver complete full stack development solutions location india uk pricing hr employees toptal company overview globally acclaimed freelance network elite software engineers including full stack startupready developers location global remote pricing hr employees upstack company overview offers handpicked full stack developers global talent pool enterpriselevel saasbased projects location usa remote pricing hr employees codeable company overview specializes wordpress full stack development vetted freelancers providing backend frontend solutions location denmark remote pricing hr employees devteamspace company overview platform offering aipowered agile teams scalable full stack development enterprisegrade solutions location usa remote pricing hr employees xteam company overview provides dedicated full stack development teams focus innovation productivity across multiple tech stacks location usa global remote pricing hr employees fullstack labs company overview specializes modern full stack web mobile development using react nodejs aws location usa colombia pricing hr employees pixelcrayons company overview indianbased company offering endtoend full stack development services flexible hiring models location india pricing hr employees valuecoders company overview offers remote full stack developers skilled mean mern lamp stacks serving global clients since location india pricing hr employees hyperlink infosystem company overview full stack services mobile web platforms expertise modern stacks enterprise integrations location india usa pricing hr employees contus tech company overview known realtime messaging ott platforms scalable full stack digital product development location india usa pricing hr employees brainvire company overview enterprise digital transformation experts offering custom full stack development focus performance roi location usa india uae pricing hr employees radixweb company overview offers wide array services including full stack development web apps cloud enterprise software location india usa pricing hr employees net solutions company overview provides cuttingedge full stack development digital commerce enterprise systems experience design location india usa canada pricing hr employees clarion technologies company overview offers remote full stack developers specializing agile development smbs enterprises location india usa pricing hr employees radiansys inc company overview silicon valleybased full stack development firm delivering scalable secure cloudnative apps location usa india pricing hr employees series inc company overview full stack development company experience ai iot mobile app development location india usa pricing hr employees closeloop technologies company overview offers innovative full stack solutions startups enterprises using modern development practices location usa india pricing hr employees dev technosys company overview provides advanced full stack development services specialization ecommerce healthtech mobility location india uae usa pricing hr employees fingent solutions company overview technology partner enterprises offering strategic full stack development focus business outcomes location usa uae india pricing hr employees qburst company overview global software solutions provider delivering full stack services cloudnative applications devops location usa india uae pricing hr employees",1,"2025-05-16 15:13:33","Honest-Musician7314"
"reddit","reddit","good dream",59,"2025-05-16 15:10:16","deadflesh8"
"reddit","reddit","deze manier van scam bekend heb fiets te koop gezet op facebook market iemand zogezegd geïnteresseerd maar ik moest wel een account maken bij dsv transport bedrijf ik stuur je kan halen ik kom hem brengen hij zou genk wonen dat vlak bij hasselt ik heb al betaald zegt ie begint dwingend te schrijven na nogmaals herhalen ik kan brengen je komt halen begon hij met sancties te dreigen toen ik er wel klaar mee na zoeken op naam komen er facebook profielen opduiken waarvan een groot deel met dezelfde foto verschillende profiel teksten hij woont luik beringen genk en nog wat plaatsen hij erg snel met een scan van zijn zogenaamde id kaart ik kan hier geen namen zetten vermoed ik maar alles schreeuwt scam voor mij iemand ervaring mee",12,"2025-05-16 15:09:38","Mortem2604"
"reddit","reddit","de corruptie van links",0,"2025-05-16 14:42:00","HugeEconomist1490"
"reddit","reddit","techgigant paniek china slaat apocalyptische slag china zet techgigant onder druk wat betekent dit voor de wereldwijde technologie deel je mening en laten discussiëren httpsitinsightsnlanalysestechgigantinpaniekchinaslaatapocalyptischeslag",1,"2025-05-16 14:31:09","itinsightsNL"
"reddit","reddit","miljonairs onthullen geheim europese beurs ontploft miljonairs onthullen geheim europese beurs ontploft wat denken jullie van deze positieve trend op de markten deel je gedachten httpsitinsightsnlanalysesmiljonairsonthullengeheimeuropesebeursontploft",1,"2025-05-16 14:30:34","itinsightsNL"
"reddit","reddit","peiling ipsos io van mei op april presenteerden de fractievoorzitters van pvv vvd bbb en nsc de voorjaarsnota kiezers delen hun enthousiasme niet maar dit heeft geen electorale gevolgen de ipsos iozetelpeiling van mei coalitiepartij nsc heeft het moeilijk na het vertrek van fractievoorzitter pieter omtzigt en haalt deze peiling één zetel verantwoording dit onderzoek vond plaats van vrijdag tot maandagochtend mei er geen opdrachtgever totaal werkten nederlanders van jaar ouder mee aan dit onderzoek de steekproef grotendeels getrokken het io research panel een deel n deed mee via panelclix dit zijn voornamelijk jongeren lager opgeleiden en respondenten met een nietwesterse achtergrond de onderzoeksresultaten zijn gewogen op geslacht leeftijd regio opleidingsniveau en stemgedrag bij de tweede kamerverkiezingen november de weging uitgevoerd conform de richtlijnen van de gouden standaard cbs hiermee de steekproef representatief voor de kiesgerechtigde nederlandse inwoners voor wat betreft deze achtergrondkenmerken bij onderzoek er sprake van een betrouwbaarheidsinterval en onnauwkeurigheidsmarges dit onderzoek gaan uit van een betrouwbaarheid van procent bij een steekproef van n en een uitkomst van procent er sprake van een foutmarge van plus min procent",56,"2025-05-16 14:25:57","Bernie529"
"reddit","reddit","new remote job deel deel hiring senior payroll associate australia payrollhttpsjobsashbyhqcomdeelcccabcfdadef nocommute daily newsletter justposted remote jobs get hundreds jobs like sent email x week subscribe herehttpswwwnocommutejobcom",1,"2025-05-16 14:13:14","NoCommute"
"reddit","reddit","klein kunstenaar vrydag elke vrydag vier ons nuwe en opkomende kunstenaars wat ons taal se musiek vorentoe dryf deel hulle youtube spotify deezer apple music wat ook al platform hulle op bestaan verkieslik gepubliseerde kunstenaars",1,"2025-05-16 13:01:37","AutoModerator"
"reddit","reddit","megapromotie aziatische insider onthult metas geheime wapen megapromotie insider onthult metas geheime wapen aziëpacific wat vinden jullie van deze strategische zet van meta deel je mening meta discussie httpsitinsightsnlhetlaatsteitnieuwsmegapromotieaziatischeinsideronthultmetasgeheimewapen",1,"2025-05-16 11:31:17","itinsightsNL"
"reddit","reddit","universiteit advies hallo julle ek n eerstejaarstudent wat tans n baie swaar tyd op universiteit beleef ek voel ongelooflik eensaam hier en die werkdruk net te veel om te hanteer deesdae begin ek al hoe meer hopeloos voel oor alles ek weet regtig nie meer wat om te doen nie daarom hoop ek iemand hier kan dalk raad gee hul eie ervaring deel ek het grootgeword n klein dorpie namibië en nog van kleins af het ek altyd gevoel ek nie rêrig êrens inpas nie ek altyd die een wat stil wat diep gedink het wat gesukkel het om gemaklik groepies te wees ek het altyd gehoop dat wanneer ek eendag universiteit toe gaan ek dalk n nuwe begin sou kry n plek waar ek meer kan wees en mense kan ontmoet wat verstaan maar toe ek stellenbosch toe getrek het het ek besef dit baie meer oorweldigend wat ek gedink het die eensaamheid dalk die moeilikste deel van alles ek sien elke dag ander studente om wat vriende en groepies het terwyl ek byna al tyd alleen deurbring buiten die klaskamer het ek niemand om mee te gesels saam te leer nie ek probeer soms dapper wees en met mense praat maar ek nogal skaam en teruggetrokke introvert dit voel net ek nie kan aansluit nie party aande gaan slaap ek met n swaar hart omdat ek afgesonder voel emosioneel ek heeltemal uitgeput en moedeloos soms voel dit asof al hierdie moeite verniet en ek begin wonder ek goed genoeg om hier te wees elke keer dinge moeilik raak oortuig daardie klein negatiewe stemmetjie dat ek gaan misluk hierdie negatiewe gedagtes maak dit moeilik om gemotiveerd te bly met studies daar al dae wat ek net wil handdoek ingooi en alles los al weet ek diep hart dat ek nie regtig droom wil prysgee nie verder daar die druk van ouers se verwagtinge en finansiële opofferings ouers betaal veel wat hulle kan en vertrou daarop dat ek kant bring want ons kan nie nog n jaar n tweede kans bekostig ek sou druip nie hierdie gedagte knaag elke dag aan wat ek hulle teleurstel ek voel skuldig dat ek selfs daaraan dink asof ek hulle opofferings nie waardeer nie die vrees om nie sukses te behaal nie maak dat ek nog meer onder druk plaas wat dit nóg moeiliker maak om op werk te konsentreer uiteindelik moet ek erken dat ek nie meer weet hoe om hierdie situasie aan te pak nie ek probeer bes maar dit voel regtig asof ek besig om te verdrink onder al hierdie druk en gevoelens ek radeloos en bang dat dit net al hoe erger gaan word ek niks daaraan doen nie daarom skryf ek hierdie post die hoop dat iemand dalk raad het hul ervaring kan deel jy al deur iets soortgelyks gegaan het hoe het jy dit deurgekom het jy enige praktiese wenke om die eensaamheid en stres beter te hanteer selfs net hoe om moed te hou enige ondersteuning empatie sal ek opreg waardeer dankie dat julle tot hier gelees het ek waardeer dit regtig en sien uit na enige advies van hierdie gemeenskap",13,"2025-05-16 10:19:52","Additional_Worth2256"
"reddit","reddit","bouwen iets voor mensen die graag delen jouw input telt hoi allemaal ik ben een klein onderzoekje aan het doen hoe mensen spullen met elkaar delen zoals gereedschap keukentoestellen tuinmateriaal het onderdeel van shareit een lokaal project waarmee het makkelijker willen maken om dingen uit te lenen te lenen van je buren denk aan een soort platform waar je veilig en snel kan delen met mensen je buurt zowel privé met vrienden familie als openbaar je wijk als je minuten tijd hebt om een korte vragenlijst te vullen help je ons enorm httpsformtypeformcomtowrethchttpsformtypeformcomtowrethc problemen met laden schakel even je vpn uit probeer een andere browser alle antwoorden zijn anoniem en ik deel graag de resultaten achteraf de groep alvast heel erg bedankt erland ps wil je graag het verhaal achter shareit lezen built shareit community platform realworld sharinghttpsmediumcompefcbcdb",1,"2025-05-16 09:52:22","erlandvr"
