"app","source","text","score","timestamp","username"
"flexjobs","play_store","need pay browse jobs dont bother installing",1,"2025-01-01 18:57:51","him her"
"flexjobs","play_store","pay look remote job",1,"2024-12-31 02:18:25","kaylee greene"
"flexjobs","play_store","someone needs little work",3,"2024-12-30 11:54:31","Monica Stclair"
"flexjobs","play_store","explain sense makes people looking work pay find job people looking work means money likely tight employees supposed pay work theyre supposed get paid work entire app reeks typical job scam",1,"2024-12-30 07:58:10","Angela Turner (SuperDuperAng)"
"flexjobs","play_store","requires monthly fee",1,"2024-12-29 03:59:03","Susan Dean"
"flexjobs","play_store","app requires paid subscription use appealing people need money spend money get job",3,"2024-12-29 03:32:12","Holly McCombs (Serenity)"
"flexjobs","play_store","free u pay",1,"2024-12-28 11:07:32","Gabriela Arredondo"
"flexjobs","play_store","paid ridiculous amount app months yr job looking something remote searched multiple times month never found anything find jobs job app keep",1,"2024-12-28 08:47:14","Tammy Scrimgeour"
"flexjobs","play_store","brutal app take money need give nothing return app nothing give customers searching remote jobs away home youre way better use indeed job searches",1,"2024-12-28 03:20:55","dustin himour"
"flexjobs","play_store","complete waste time huge waste money better hits searching google",1,"2024-12-27 19:41:46","Jeremie Dunning"
"flexjobs","play_store","pay monthly yearly fee work already get paid well work job theft every way make cut work im paying monthly yearly oh smell lawsuit thats double dipping",1,"2024-12-27 17:21:25","Loria Landers"
"flexjobs","play_store","wont let even look available job listings without paying",1,"2024-12-27 12:58:10","Nickole Croft"
"flexjobs","play_store","paid first month cannot log look job dont know whats going want able log",2,"2024-12-23 07:34:39","Kimber Burrow"
"flexjobs","play_store","need work make money yet want pay full upfront without trial whatever benefits im supposed pay give list successful others dont think",1,"2024-12-23 01:04:31","John R"
"flexjobs","play_store","cant use unless pay",1,"2024-12-22 01:28:31","Tiffany Gerrild"
"flexjobs","play_store","worst doesnot even jobs",1,"2024-12-20 19:27:41","Louis Scott"
"flexjobs","play_store","service waste time money additionally customer service horrendous least iindeed doesnt charge incompetency note read reviews dont believe word company says responses genuine damage control also tend copy paste replies know lazy give damn",1,"2024-12-19 19:39:12","Adam Jones"
"flexjobs","play_store","worthless cancel subscription please",1,"2024-12-19 09:45:55","Marquetta Fourman"
"flexjobs","play_store","dont subscribe cant use itoh well",1,"2024-12-19 05:59:21","Vic"
"flexjobs","play_store","irrelevant job postings wont let unsubscribe",2,"2024-12-18 23:46:38","Skylar McGuire"
"flexjobs","play_store","im sorry going offer free app force us pay find job cant afford pay help find job kinda im looking job",1,"2024-12-17 21:39:09","Suga DNA"
"flexjobs","play_store","tried use find jobs cant find apps since arent working immidiately red flags go cant look app without paying",1,"2024-12-17 18:38:33","thatothergirl 007"
"flexjobs","play_store","trash charge us find jobs",1,"2024-12-13 19:45:58","SYKOTHEELIGHT (SYKO)"
"flexjobs","play_store","pay find job",1,"2024-12-13 10:53:01","Alicia Kunz"
"flexjobs","play_store","terrible app dont install",1,"2024-12-13 05:24:32","brc1 1crb"
"flexjobs","play_store","could enter canadian province setup apparently app works us useless rest world",1,"2024-12-11 01:09:29","Gerhardt Raven"
"flexjobs","play_store","pay edit reply nobody going pay chance get job star rated app reeks scam",1,"2024-12-09 22:17:24","Seth Preuter"
"flexjobs","play_store","worked illinois department security years advised veterans benefits assisted completing disability service connected paperwork va worked emplyers job development facilitated workshops job fairs",5,"2024-12-09 12:41:48","Catherine Matyas"
"flexjobs","play_store","costs money apply jobs",1,"2024-12-08 20:09:59","Naomi Violet"
"flexjobs","play_store","dont even bother app see rated stars deserves nonezero stars",1,"2024-12-08 16:21:24","Inception Prime"
"flexjobs","play_store","terrible search returns irrelevant results returns results even search clown filter cant saved keep resetting completely useless job search",1,"2024-12-07 22:58:39","Tony Nordstrom"
"flexjobs","play_store","pay try find job jobs dont always list much offering dont like limited options comes filtering try find job liking id rather research pay company give limited options using app made feel like stealing poor",1,"2024-12-07 18:48:16","Katelyn Galloway"
"flexjobs","play_store","seriously pay thanks",1,"2024-12-07 12:38:19","Lindsey Campbell"
"flexjobs","play_store","literally cant anything without paying subscription first hell would pay subscription im trying find job dont waste time downloading app literally create account theres paywall",1,"2024-12-07 09:46:34","Cody M"
"flexjobs","play_store","pay app",1,"2024-12-05 23:29:32","Shiane Hogan"
"flexjobs","play_store","scam first thing ask money without even letting know kind jobs information want money",5,"2024-12-05 22:43:00","Ryan Kinney"
"flexjobs","play_store","horriblefakescam",1,"2024-12-05 00:35:54","Lora Chase"
"flexjobs","play_store","sadly pay monthly fee order able even view jobs",1,"2024-12-04 20:45:16","Rayau"
"flexjobs","play_store","app predatory job searching subscription insane",1,"2024-12-04 09:25:37","Tyler Long"
"flexjobs","play_store","paid wont allow look anything",1,"2024-12-02 11:36:10","Sasha Ketchersid"
"flexjobs","play_store","app sucks cannot find jobs area cost says",1,"2024-12-01 02:16:58","Eriq Currie"
"flexjobs","play_store","kind job search app expects pay subscription xd absolutely kind capitalist nonsense star use indeed",1,"2024-11-28 06:36:37","Breanna Gillard"
"flexjobs","play_store","scam",1,"2024-11-28 04:16:17","Alex Towne"
"flexjobs","play_store","wants pay use app option",1,"2024-11-26 21:35:51","Craig Crowder"
"flexjobs","play_store","requires pay app even look jobs",1,"2024-11-25 19:15:24","Tiffany Crable"
"flexjobs","play_store","subscribed price lower canc emailed told u would like refund cancel access said couldnt end contact playstore issue past apps emailed directly never told contact play store",1,"2024-11-24 16:11:21","F S"
"flexjobs","play_store","dont scam stars",1,"2024-11-20 22:18:02","Brittany McIntyre"
"flexjobs","play_store","cant seem find anything liking biggest problem lie easy opt whenever want option nowhere found theres guarantee deleting account stop payments",1,"2024-11-20 19:32:09","Eric Pichardo"
"flexjobs","play_store","scam wont let past pick plan step every time try log keeps taking back saying already plan makes pay even see jobs thankfully used gift card real card dont bother tried customs service nothing",1,"2024-11-19 21:28:24","Laura Maikranz"
"flexjobs","play_store","pay work insane",1,"2024-11-19 19:20:44","Andre Keegan"
"flexjobs","play_store","scam app makes u pay scam",1,"2024-11-17 04:51:10","Google User 1234"
"flexjobs","play_store","read reviews installing ended uninstalling app seeing need pay uhmm im looking make money spend itstupid",1,"2024-11-14 20:35:24","Farhad Ahmed"
"flexjobs","play_store","scam wouldnt let get past page pick subscription even pay month",1,"2024-11-14 16:19:54","Courtney Sacheli"
"flexjobs","play_store","stupid dont waste time makes pay",1,"2024-11-13 17:27:53","Vanessa Castaneda"
"flexjobs","play_store","suggest upgrade full features features without paying actual heck know purchased app play policy obviously scam",1,"2024-11-13 17:10:46","Just0Focus"
"flexjobs","play_store","another app take money job",1,"2024-11-13 16:44:55","Stefanie “Wrabbit” Mason"
"flexjobs","play_store","wouldnt even give star could give zero stars pay one month even see theres jobs near anything youre available type work stupid hope use app refer apps similar actually work theyre making every single person kind interested thats people make money actually smart end pisses",1,"2024-11-12 23:00:49","Shannon “Shay” Dunn Durval"
"flexjobs","play_store","trying make money dont pay looking job app sucks",1,"2024-11-12 10:53:37","Michael Callaby"
"flexjobs","play_store","im downloading app make money makes think afford pay money use app",1,"2024-11-08 21:14:04","Charles Dodson"
"flexjobs","play_store","charging people need job find job crazy work",1,"2024-11-07 22:24:58","Justin Allen"
"flexjobs","play_store","scam best read reviews first learned lesson please heed words others dont waste time downloading",1,"2024-11-07 19:12:56","Nathan Holden"
"flexjobs","play_store","pay",1,"2024-11-06 19:24:32","Lillth So"
"flexjobs","play_store","wants money even start job searching ridiculous",1,"2024-11-05 13:47:28","Ray Cooper"
"flexjobs","play_store","free",1,"2024-11-05 01:35:22","Heather klug"
"flexjobs","play_store","free access app",1,"2024-11-04 00:42:31","Katlyn Cowley"
"flexjobs","play_store","sign email makes pay go first month month pay year cant even see kind jobs offer offer free trial many free job apps sites truly dont understand anyone would use app",1,"2024-11-01 19:33:21","Ciara Jones"
"flexjobs","play_store","paid subscription search criteria indeed ors job finding sites",1,"2024-11-01 03:31:02","Kevin U"
"flexjobs","play_store","pay month haha yeah finding job shouldnt cost anything",1,"2024-10-31 14:26:37","Karmen Huser"
"flexjobs","play_store","buy subscription use app",1,"2024-10-31 00:12:26","I'm Tyler Bryan (Tyler Bryan)"
"flexjobs","play_store","makes create account harvest email tells pay use app",1,"2024-10-28 08:08:03","Amber M"
"flexjobs","play_store","excellent job",5,"2024-10-28 02:39:23","Jean Ulysse"
"flexjobs","play_store","wont let past pay wall even subscription",1,"2024-10-28 01:29:39","N1kk1wa"
"flexjobs","play_store","shouldnt pay find work stupid af",1,"2024-10-27 20:47:34","Lizzy Young"
"flexjobs","play_store","requires money immediately",1,"2024-10-27 18:53:18","Mushfig Novruzov"
"flexjobs","play_store","lol im going pay without ever seen im paying deleted",1,"2024-10-27 08:14:32","Matthew Daniel"
"flexjobs","play_store","uninstalled right away tablet horrible sure samsung phone tried website instead far search results canadian jobs particularly outside ontario next nothing filtering search recent posts resulted paid required trial fee usd use ill asking refund",1,"2024-10-26 21:32:32","Liz B"
"flexjobs","play_store","everybody world become overtly greedy evil conniving selfish shows compassion masses getting richer controlling us property etc myth cant look jobs traditional way anymore real problem computers technology robotics jetsons intergalactica computerized azs world fool genius fact create app unintelligent slow decision exceptional children level adults",1,"2024-10-25 19:01:56","Michele Whitworth"
"flexjobs","play_store","like everyone else surprised pay access part app people without jobs therefore without money supposed find job charge free trial options even see app offers demand money",1,"2024-10-24 19:38:50","Emily G (xxxemilyg1996)"
"flexjobs","play_store","job search guarded paywall joke concept",1,"2024-10-22 14:35:18","Steven"
"flexjobs","play_store","app beyond sŧüpđ earth pay finding jobs makes sense app another scam get money something could free words app useless",1,"2024-10-20 00:26:46","Azza"
"flexjobs","play_store","takes email address cant anything without paying",1,"2024-10-19 20:28:57","Ms. Chelle G"
"flexjobs","play_store","im paying money find job",1,"2024-10-19 03:23:09","Leola Sigers"
"flexjobs","play_store","pay find job absurd discounted first month jumps month look lists im sure arent legit employers people crazy think real person looking job going pay monthly fee look app",1,"2024-10-18 13:40:20","Bradley Young"
"flexjobs","play_store","requires subscription anything",1,"2024-10-17 19:00:42","Dan-Maz"
"flexjobs","play_store","charge people find job arent even providing scouting service assistance anything youre literally pulling job info sites charging people shameful",1,"2024-10-17 16:16:18","Cohen Huntington"
"flexjobs","play_store","pay even continue setting app use deleted immediately would given worse star available",1,"2024-10-16 23:42:17","Alasa Oghele Happiness"
"flexjobs","play_store","dumbest app ever u gonna charge dollars month im look make money ur trying take money dont google apps biggest scam theres jobs boycott google play store",1,"2024-10-16 18:36:56","Cxkii Ikram"
"flexjobs","play_store","pay find job actually money wouldnt need job search app sayin",1,"2024-10-15 17:25:43","Katie Garry"
"flexjobs","play_store","started using app havent chance land job far say legit doesnt give run around send one link another every job link takes directly company well organized straightforward search engine results filters though could much accurate suggestion",4,"2024-10-15 12:34:17","Christina Cassandra Kent"
"flexjobs","play_store","im really fan pay app general especially cannot even test even limited amount features app free pay unlock rest least give users feel app offer forcing paid subscription costs throats interested checking app came across play store personally pay app dont even know im paying work",1,"2024-10-14 17:38:26","g"
"flexjobs","play_store","purchase subscription use app",1,"2024-10-13 17:03:25","Ethan Carr"
"flexjobs","play_store","weryfunah",4,"2024-10-13 16:01:21","Todd Brightwell (Bakewell)"
"flexjobs","play_store","free option paid im paying app find job earn money",1,"2024-10-12 17:46:06","Elizabeth Cellery"
"flexjobs","play_store","good idea subscription service app free smh im gonna pay get job thats ridiculous wanna help dont fatten pockets helping people wanted help finding remote job",1,"2024-10-12 14:48:15","Nabreesha Bacon"
"flexjobs","play_store","free download free use",1,"2024-10-11 15:28:10","Lauren Fields"
"flexjobs","play_store","helpful",5,"2024-10-11 12:34:24","Jeaneaus Travels"
"flexjobs","play_store","omg seems like literally every job allow california residents work bullshi",1,"2024-10-10 20:24:52","Shannon J. Brooks"
"flexjobs","play_store","display compatible tab lite view half page think wanted purchase something view anything unable see display cut everything half may try ultra later",1,"2024-10-10 08:29:09","Lindsey Corbett"
"flexjobs","play_store","month fees upfront",1,"2024-10-10 06:06:57","Charles Smith"
"flexjobs","play_store","right getgo want pay money try get job wth",1,"2024-10-09 05:52:39","maya b"
"flexjobs","play_store","app stays load screen edit worked thanks",4,"2024-10-07 19:27:31","Jeff Gilbertson"
"flexjobs","play_store","great interesting app",5,"2024-10-04 22:27:13","JoeBanks"
"flexjobs","play_store","make pay access job worth im looking make money give money hope make",1,"2024-10-04 14:10:44","Pricillia Valdez"
"flexjobs","play_store","easy use lots potential jobs real verified employers",5,"2024-10-04 04:25:27","Marcus Tomlinson"
"flexjobs","play_store","cons saved lot postings none appear saved tab went back search found one shows heart highlighted none actually frustrating go back find option select night overnight shifts flexible alternative hard time finding specifically overnight shifts option email jobs pros lot listings lots useful filters search helpful articles",3,"2024-10-03 21:26:47","Marina Johnson"
"flexjobs","play_store","ive enjoyed working flexjobs throughout years emphasis screened jobs awesome help avoid scams",5,"2024-10-02 23:16:57","Michael Nelson"
"flexjobs","play_store","app wants paid month",1,"2024-10-02 21:26:12","Alicia Finisterre"
"flexjobs","play_store","site saturated paying look jobs dont make sense",1,"2024-09-30 18:23:34","Rug"
"flexjobs","play_store","im currently laid money pay create account look jobs tone deaf ask",3,"2024-09-28 17:24:31","Cassie Sharp"
"flexjobs","play_store","users looking job point theyre looking smaller apps would assume theyd pay subscription",1,"2024-09-24 23:23:37","ClaraBot"
"toptal","play_store","toptals fees incredibly misleading seemed designed confuse making far easy overspend recommend app anyone future spare frustration opt platforms like upwork instead value money far superior talent upwork matches toptals theres really point sticking overcomplicated overpriced service",1,"2025-05-12 15:54:58","Michelle"
"toptal","play_store","toptal platform really good freelancer contractor apps still complete using app unable messaging buyer hope next version update facilities",5,"2025-04-07 17:14:36","Forhad Shamim"
"toptal","play_store","youre hiring avoid toptal charge front end access network isnt good offered one candidate turns wasnt available spent hours spec conversations candidate etc would describe toptal much like scam waste time money",1,"2025-03-29 19:50:13","Kevin"
"toptal","play_store","much",3,"2025-01-22 07:31:43","Halima Sultan"
"toptal","play_store","love app",5,"2024-11-08 16:31:53","Grace"
"toptal","play_store","disgusting app tech overloads slave even harder",1,"2024-10-15 19:11:32","Andrew Crooks"
"toptal","play_store","recommended dont even give another chance revise information block account",1,"2024-08-28 18:48:36","Dr.Zabihullah Shakir_RPh"
"toptal","play_store","time consuming simple verificationa",1,"2024-07-02 10:50:53","Nayamat"
"toptal","play_store","spend ton time registering say pay usd send applications",1,"2024-06-27 23:43:32","Gabriel Lie Alonso"
"toptal","play_store","best investment platform",5,"2024-06-04 07:19:12","ENENCHE EKOJA"
"toptal","play_store","nonsense useless app dont even let creat simple account hire",1,"2024-05-05 14:28:43","Alex Alex"
"toptal","play_store","amazing app",5,"2024-04-10 08:34:40","Vitalii Nikiforov"
"toptal","play_store","dont use app site staff rude used one word indian dont use want withdray money pay withdraw charge extra id means therir help centre good reply hour resolve problem manager bad dont used reply offline freelancing app site loot people dont give theirmoney",1,"2024-01-18 07:07:03","Aditya Garg"
"toptal","play_store","worst freelancing site ever dont deserve even one star",1,"2023-12-03 23:48:10","Idriss Idriss"
"toptal","play_store","responsible app freelancer",1,"2023-11-20 00:54:16","Shadiat Adejumo"
"toptal","play_store","trash app",1,"2023-10-20 23:55:25","Frank P."
"toptal","play_store","registered app email copywriter filling forms answering questions getting point trying upload work experience pdf file im issues past three days still keep telling try later",1,"2023-10-12 17:00:19","Frank Edward"
"toptal","play_store","poor app unable complete making profile showing error uploading resume wasted min creating profile resulted nothing one use app profile bnane hi pnga krdia kya hi work provide karege ye",1,"2023-09-27 10:47:01","Prachi Pareek"
"toptal","play_store","great app toptal web features experiences integrated everyday smooth updates good work enough hours notice mobile app would really help",5,"2023-08-27 10:05:24","Arafat jamil"
"toptal","play_store","solid",5,"2023-08-23 19:30:57","Brian Mason"
"toptal","play_store","steal data say cant join network pathetic people",1,"2023-07-25 06:08:31","Shaheer Rehman"
"toptal","play_store","downloaded app started creating profile requested name location resume projects want work ideal work environment etc profile complete received notice didnt required experience account locked could rejected right beginning instead wasting time filling info",1,"2023-07-21 21:03:43","Alex G."
"toptal","play_store","offered registration filling forms said didnt meet conditions put waiting list collected data abandoned require contact support delete account threatening wont able register came across unfamiliar application search intimidate add everyone waiting list appear important dont download app waste time",1,"2023-07-08 03:54:50","vik castro"
"toptal","play_store","worst app freelancing want experience dont understand newbies",1,"2023-06-07 19:14:48","Xingo FF"
"toptal","play_store","sigin google doesnt work signup option app",1,"2023-05-23 17:58:08","Paresh Vengurlekar"
"toptal","play_store","bad",1,"2023-05-13 14:56:14","Robiul Islam"
"toptal","play_store","worst freelancing app ever seen",1,"2023-05-11 12:54:37","Nishant Sidhani"
"toptal","play_store","stupid developers dont want success newbie game nationality citizenship location signing one either one goes red another cant sign register app stupid",1,"2023-05-06 17:48:11","Michael Obamo"
"toptal","play_store","toptal app intuitive easy use access info phone also read great content developer blog feature request please add payment transfer feature",5,"2023-04-10 07:30:08","Jyothi Asapu"
"toptal","play_store","app really makes easy handle contracts prefer browser one",5,"2023-04-04 12:27:47","Alexandru Suciu"
"toptal","play_store","great app thank highly recommend remote workers",5,"2023-03-26 15:33:40","Zablon Dawit"
"toptal","play_store","wonderful app make easy toptal talents like find jobs track payments also notifies us new jobs paymentsx engagement updates etc",5,"2023-03-18 00:01:33","Christian Balola"
"toptal","play_store","worth noting",1,"2023-03-14 00:50:08","Monesse KHAMISSIA"
"toptal","play_store","toptal app works great information need home screen provides excellent overview works smooth butter thanks",5,"2023-02-28 17:51:04","Michiel Huiskens"
"toptal","play_store","pay rate low matchers dont respond requests waste time go tough interview process get value back",1,"2023-02-26 09:52:22","Morhaf Shamia"
"toptal","play_store","attracts bottom feeders takes cut profits probably also write promotional article useless service get front door use braintrust instead create talent network",1,"2023-02-25 09:54:22","Eric G"
"toptal","play_store","super simple easy use makes searching jobs keeping new job notifications interest requests way easier",5,"2023-02-09 20:07:09","El-Dababa"
"toptal","play_store","using app year user experience getting improved every releases",5,"2023-02-01 19:28:57","Aravinthan Asokan"
"toptal","play_store","app really good regular updates new functionality makes finding jobs easier quick notifications preferences great job",5,"2023-02-01 18:06:16","Muhsin Ahmad"
"toptal","play_store","great substitute web im go",5,"2023-02-01 16:52:28","Rafael Suazo"
"toptal","play_store","awesome app great uxui",5,"2023-01-31 16:49:47","Leonardo Pliskieviski"
"toptal","play_store","app great ux well designed easy use find everything need notime",5,"2023-01-31 15:23:42","Blanka Pop"
"toptal","play_store","connects talent job opportunities across world",5,"2023-01-31 14:10:00","Gaurav Shastri"
"toptal","play_store","awesome app toptal talent gives much needed tools overview account go phone keep good work suggestion would add option customize see dashboard",5,"2023-01-31 13:50:41","Antinjo Zebara"
"toptal","play_store","good freelancers",5,"2023-01-31 13:44:39","Arpit Pandey"
"toptal","play_store","best app freelancing amazing user interface community",5,"2023-01-31 13:43:17","Shubham somani"
"toptal","play_store","toptal app great easy use everything app constantly improve app amazing",5,"2023-01-31 13:40:29","Bojan MItevski"
"toptal","play_store","amazing app great user experience",5,"2023-01-25 10:57:35","Vladimir Koncos"
"toptal","play_store","great app",5,"2023-01-24 00:12:55","Arslan Shoukat"
"toptal","play_store","trash",1,"2023-01-10 16:51:55","spam acc"
"toptal","play_store","great app allows manage toptal needs phone",5,"2022-12-29 23:31:42","Tom Lovett"
"toptal","play_store","covers needs freelancer",5,"2022-12-23 10:57:10","Yernar Amergaliyev"
"toptal","play_store","cant login strong password mobile",3,"2022-10-30 13:35:53","Fatih Gucuko (Webinify Creative)"
"toptal","play_store","one best plateform freelansers",5,"2022-10-29 20:16:11","Ramzan Malik"
"toptal","play_store","got rejected communication mark interviewer said highprofile client though explain everything asks tech stacks everything although worked multiple overseas clients also interacted native speakers took requirements easily however god knows notice bad get strict developers never find one",4,"2022-09-02 15:43:47","juned shaikh"
"toptal","play_store","prepared pay exorbiant fees hourly rates mediocre results based experience high hourly rate motivates work snails pace quickly spirals control know youve spent several thousand real work complete case cancelled days spend reached k provided handful lackluster wireframes claim top talent like top sandbaggers",1,"2022-08-18 00:27:36","Gonzalo Gonzalez"
"toptal","play_store","wish part toptal",5,"2022-08-15 13:27:44","Ossama Mehmood (샘)"
"toptal","play_store","fraud app freelancers better go apps gives far better platform freelancers never go useless app",1,"2022-07-16 13:42:32","Himanshu Bisht"
"toptal","play_store","possible give star would done problem lies toptal meeting link earlier scheduled stayed kept joining link one joined interview bloody liars sent email telling meeting schedule please sll web apo developers join company toptal scam",1,"2022-07-11 10:15:56","Jessy (Gab)"
"toptal","play_store","cant register new account app option register new account",1,"2022-07-04 00:43:39","LOBO Gaming (Niazi)"
"toptal","play_store","log linkedin ap",3,"2022-06-10 23:39:33","Mohammad Shahidullah Chowdhury"
"toptal","play_store","best platform ever",5,"2022-06-01 22:38:24","Badreddine B."
"toptal","play_store","signed applied web using linkedin sign app allowing linkedin sign use app sign kindly resolve others linke sign",4,"2022-05-29 14:23:14","Vaibhav Structurals"
"toptal","play_store","app doesnt even open cant create account even log",1,"2022-05-14 05:09:09","Somtosco Limited"
"toptal","play_store","best place earn job",5,"2022-05-05 11:26:05","akansha dubey"
