"app","source","text","score","timestamp","username"
"reddit","reddit","vesthane vale ervaringen oplichterij betrouwbaar heb je je ooit afgevraagd er een platform dat je trading ervaring naar een hoger niveau kan tillen de wereld van trading platforms vesthane valehttpsnclybyc steeds populairder aan het worden veel gebruikers prijzen het vanwege zijn gebruiksgemak en innovatieve functies maar wat maakt vesthane vale anders dan de rest deze review duik ik diep de wereld van vesthane vale en deel ik enkele unieke inzichten die je misschien nog niet kent je nu een doorgewinterde trader bent net begint deze review biedt je alles wat je moet weten vesthane vale open nu je vesthane vale accounthttpsnclybyc overzicht kenmerken details platform type trading platform ondersteunde activa meerdere inclusief crypto minimale storting mobiele toegang ja realtime analyse ja ondersteunde landen wereldwijd beperkte uitzonderingen klantenservice ondersteuning wat vesthane vale vesthane vale een trading platform dat gebruikers toegang biedt tot een breed scala aan financiële activa het ontworpen om zowel beginners als ervaren handelaren een naadloze ervaring te bieden met zijn geavanceerde functies en tools kunnen gebruikers marktanalyse uitvoeren en weloverwogen beslissingen nemen het platform streeft ernaar om de kloof tussen traditionele financiële markten en opkomende digitale activa te overbruggen wat vesthane vale onderscheidt de focus op gebruiksgemak en toegankelijkheid het platform biedt een intuïtieve interface die zelfs voor beginners gemakkelijk te navigeren daarnaast er aandacht besteed aan veiligheid en klantondersteuning wat het een betrouwbare keuze maakt voor handelaren wereldwijd wie heeft vesthane vale gecreëerd vesthane vale ontwikkeld door een team van ervaren financiële en technologische experts hun doel om een platform te creëren dat tegemoetkomt aan de behoeften van de moderne handelaar door samen te werken met professionals uit verschillende velden hebben ze een omgeving gecreëerd die zowel innovatief als stabiel het team blijft het platform voortdurend verbeteren door middel van feedback van gebruikers en technologische ontwikkelingen deze voortdurende toewijding aan verbetering maakt vesthane vale een dynamisch en vooruitstrevend platform begin vandaag nog met handelen op vesthane valehttpsnclybyc hoe werkt vesthane vale vesthane vale werkt door gebruikers toegang te bieden tot marktanalysetools en handelssystemen die hen helpen bij het maken van weloverwogen beslissingen gebruikers kunnen gemakkelijk verschillende activa verhandelen door gebruik te maken van de geavanceerde algoritmen die het platform aandrijft de interface ontworpen om gebruikers een moeiteloze navigatie te bieden na registratie kunnen gebruikers hun accounts financieren en beginnen met handelen het platform biedt ook aanpasbare meldingen en realtime updates om ervoor te zorgen dat gebruikers op de hoogte blijven van marktbewegingen vesthane vale voor en nadelen zoals elk platform heeft vesthane vale zijn sterke en zwakke punten voordelen zijn onder andere de gebruiksvriendelijke interface de realtime marktanalyse en de veelzijdigheid van activa die kunnen worden verhandeld het platform bovendien toegankelijk op zowel desktop als mobiele apparaten wat flexibiliteit biedt aan gebruikers nadelen zijn dat er een minimale storting vereist wat voor sommige nieuwe gebruikers een barrière kan vormen ook kan de klantenservice hoewel beschikbaar soms traag reageren tijdens piekuren desondanks wegen de voordelen zwaarder en maken ze vesthane vale een aantrekkelijke optie voor velen welke apparaten kunnen worden gebruikt om toegang te krijgen tot vesthane vale vesthane vale ontworpen met toegankelijkheid gedachten en kan worden gebruikt op verschillende apparaten je nu liever handelt vanaf je desktop onderweg via je smartphone het platform compatibel met de meeste systemen er geen speciale software vereist alles werkt via je internetbrowser de mobiele versie van vesthane vale geoptimaliseerd voor gebruiksgemak en biedt dezelfde functies als de desktopversie dit betekent dat je altijd en overal toegang hebt tot je account en marktinformatie zolang je verbinding hebt met internet vesthane vale ondersteunde landen vesthane vale beschikbaar voor handelaren wereldwijd met enkele uitzonderingen de meeste grote markten worden ondersteund maar gebruikers moeten controleren hun specifieke land wordt ondersteund voordat ze zich registreren dit wereldwijde bereik maakt het platform toegankelijk voor een breed scala aan gebruikers het platform blijft zich uitbreiden naar nieuwe markten zodat meer mensen toegang krijgen tot de voordelen van vesthane vale dit toont hun toewijding aan het bieden van een inclusieve en uitgebreide handelsoplossing vesthane vale belangrijkste kenmerken realtime marktanalyse een van de meest gewaardeerde functies van vesthane vale de realtime marktanalyse dit stelt gebruikers staat om altijd de meest actuele informatie te hebben en snel te spelen op marktveranderingen de data wordt gepresenteerd een overzichtelijke en begrijpelijke manier zodat zelfs beginners er profijt van kunnen hebben gebruiksvriendelijke interface vesthane vales interface ontworpen met de gebruiker gedachten het intuitief en gemakkelijk te navigeren wat het ideaal maakt voor zowel beginners als ervaren handelaren alle belangrijke functies zijn gemakkelijk toegankelijk waardoor gebruikers snel kunnen handelen zonder gedoe mobiele toegankelijkheid het platform biedt volledige mobiele toegankelijkheid wat betekent dat je kunt handelen waar en wanneer je maar wilt de mobiele interface net zo gebruiksvriendelijk als de desktopversie zonder concessies te doen aan functionaliteit snelheid aanpasbare meldingen met aanpasbare meldingen kunnen gebruikers hun handelservaring personaliseren deze functie stelt je staat om specifieke marktwaarschuwingen en updates te stellen zodat je geen belangrijke bewegingen mist handel meerdere activa vesthane vale ondersteunt handel meerdere activa van traditionele aandelen tot moderne cryptocurrencies deze diversiteit biedt gebruikers de mogelijkheid om hun portefeuilles te spreiden en risicos te minimaliseren open nu je vesthane vale accounthttpsnclybyc vesthane vale een scam het begrijpelijk dat sommigen zich zorgen maken de legitimiteit van online trading platforms echter na grondige evaluatie en gebruikerservaringen lijkt vesthane vale een betrouwbaar platform te zijn het heeft een sterke reputatie opgebouwd door transparantie en effectieve klantenondersteuning gebruikers moeten echter altijd voorzichtig zijn en hun eigen onderzoek doen hoewel vesthane vale veel positieve kenmerken heeft het belangrijk om verantwoordelijk te handelen en te investeren wat de minimale storting die vereist op vesthane vale de minimale storting om te beginnen met handelen op vesthane vale dit bedrag vrij gebruikelijk de industrie maar kan een drempel vormen voor beginnende handelaren het belangrijk om te onthouden dat dit bedrag wordt gebruikt als je eerste investering en niet als een vergoeding voor het gebruik van het platform vesthane vale klantenservice de klantenservice van vesthane vale beschikbaar om gebruikers te ondersteunen hoewel de ondersteuning het algemeen efficiënt kan er tijdens drukke periodes enige vertraging optreden bij het reageren op vragen het team echter toegewijd aan het bieden van hulp en het oplossen van problemen hoe begin je met handelen op vesthane vale stap meld je aan voor een gratis account om aan de slag te gaan moet je je registreren voor een gratis account dit proces eenvoudig en vereist alleen basisinformatie je ontvangt een bevestigingsmail om je account te activeren stap verifieer en financier je account na registratie moet je je account verifiëren en financieren met de minimale storting van verificatie een belangrijk veiligheidsproces dat helpt om je account te beschermen tegen fraude stap begin met handelen zodra je account geverifieerd en gefinancierd kun je beginnen met handelen gebruik de tools en functies van het platform om weloverwogen beslissingen te nemen en je handelsstrategieën aan te passen hoe verwijder je een vesthane valeaccount het sluiten van je vesthane valeaccount een rechttoe rechtaan proces je moet contact opnemen met de klantenservice die je verder zal begeleiden zorg ervoor dat je alle fondsen opneemt voordat je je account sluit om complicaties te voorkomen begin vandaag nog met handelen op vesthane valehttpsnclybyc conclusie vesthane vale biedt een solide platform voor handelaren van alle niveaus het combineert gebruiksgemak met krachtige functies waardoor het een aantrekkelijke optie voor iedereen die serieus wil handelen hoewel er enkele nadelen zijn zoals de minimale storting en occasionele vertraging klantenservice wegen de voordelen meestal zwaarder het een platform dat de moeite waard om te verkennen voor zowel beginners als ervaren handelaren veelgestelde vragen faqs wat zijn de ervaringen van gebruikers met vesthane vale de meeste gebruikers zijn positief hun ervaringen met vesthane vale ze prijzen de gebruiksvriendelijke interface en de diversiteit aan beschikbare activa vesthane vale veilig om mee te handelen ja vesthane vale heeft sterke beveiligingsmaatregelen om de veiligheid van gebruikers te waarborgen het echter altijd belangrijk om voorzichtig te zijn en persoonlijke gegevens te beschermen welke kosten zijn verbonden aan het gebruik van vesthane vale vesthane vale rekent geen verborgen kosten maar er kunnen standaard handelscommissies van toepassing zijn het goed om de voorwaarden te controleren voordat je begint hoe snel kan ik mijn winst opnemen van vesthane vale opnames zijn het algemeen snel maar kunnen variëren afhankelijk van de gekozen betaalmethode het gebruikelijk dat opnames binnen enkele werkdagen worden verwerkt biedt vesthane vale educatieve middelen voor nieuwe handelaren ja vesthane vale biedt diverse hulpmiddelen en bronnen om nieuwe handelaren te helpen bij hun leerproces wat zijn de minimale en maximale handelslimieten op vesthane vale de handelslimieten kunnen variëren afhankelijk van het type activa en de marktomstandigheden het raadzaam om de specifieke voorwaarden op het platform te controleren zijn er verborgen kosten bij het gebruik van vesthane vale nee vesthane vale staat bekend om zijn transparantie en er zijn geen verborgen kosten alle kosten worden duidelijk vermeld voordat je een transactie voltooit",1,"2025-05-13 09:09:19","Ill_Will_8438"
"reddit","reddit","senior product operations manager deel united states httpsweloveproductcojobsseniorproductoperationsmanagerdeelcrydutm_sourceredditutm_mediumbot",1,"2025-05-13 08:48:00","bertwitt"
"reddit","reddit","day road deel views yesterday",7,"2025-05-13 06:06:12","sahira12"
"reddit","reddit","ongezellig fan continuation deel guys totally hasnt months since last one yet relationship stuff school got way school year coming close deeply apologize hope enjoy one deel httpsdocsgooglecomdocumentdduomzixz_o_tfp_lagidgzclzgtzsplrpcwzedittabthttpsdocsgooglecomdocumentdduomzixz_o_tfp_lagidgzclzgtzsplrpcwzedittabt full series httpsdocsgooglecomdocumentdjohnykwfiobptonvagqufhtzfrfjdfusau_xcedittabtheadinghwpkjuhcpyihttpsdocsgooglecomdocumentdjohnykwfiobptonvagqufhtzfrfjdfusau_xcedittabtheadinghwpkjuhcpyi",12,"2025-05-13 05:39:21","65DaleRamirez65"
"reddit","reddit","want make things right virtual assistant earning k k month depending overtime nakokonsensya nako paying income tax also realized power itr tin worked since sa ph private employers laging may payment dahil auto deduct ng companies nag transition ako sa va agency na nag babayad ako ng sss pag ibig philhealth pero di consistent also sa deel ako nakaka recieve ng salary robinsons bank yung deel ko nilagyan ko ng tin pero never ako ng file ng taxes nag pa change self employed im thinking resigning around june july transfer different va agency want start anew file taxes na may utang ba ako sa bir since go sa bir soon possible wait till start new job im noob might get lot hate post know diba forms fill pero idea na im hoping get answers next steps thank",35,"2025-05-13 05:33:02","Glittering_Local2025"
"reddit","reddit","het eerste deel staat afzonderlijk letters antwoord httpswwwpuzzelwoordenboeknucomheteerstedeelstaatafzonderlijklettershttpswwwpuzzelwoordenboeknucomheteerstedeelstaatafzonderlijkletters",1,"2025-05-13 05:29:30","riddleman01"
"reddit","reddit","hiring senior golang engineer remote emea wundergraph work anywhere europe wundergraph fastgrowing startup mission redefine companies leverage graphql federation scale north star enable collaboration across small large organizations using apis backbone business growth want make impact voice heard work nobs organization get stuff donelook apply today role building wundergraph cosmo opensource graphql federation solution probably important component cosmo cosmo router simply put connects api endpoints handles graphql requests responses whilst applying federation protocol among magical things like normalization execution planning etc fully written go fastest graphql router available quite potent complex piece cuttingedge opensource software joining team make even better strap rocket boosters onto graphql federation team integration report cto align ceo product cco customer feedback support consult engineering team charge develop refactor maintain graphql go tools router opensource code base golang low gc code work closely engineering team mates new router capabilities eg open federation new data sources focus performance security stability router review router telemetry identify areas improvement run internal penetration tests router troubleshoot router issues potentially together customers engineers analyze accept opensource contributions github engine essentially golang application translates graphql requests protocol like openapi soap grpc graphql apollo federation etc could consider engine graphql compiler transpiler engine responsible parsing normalization execution planning execution runtime etc interested working asts ast transformations etc love kind work performance requirements proficient writing performant low gc code golang tasks take weeks complete ideally youre someone likes go deep one topic instead going wide shallow many different topics heres list things might working extend compiler backend support apollo federation v extend compiler backend support grpc implement native gobased data source soap openapi currently using nodejs based solution bridge improve batchingimplementation engine improve performance engine general driven feedback customers ceo time id enjoy kind work unfortunately role requires focus marketing sales product aspects company thats looking expand engine team bring team senior level proven golang development experience leading ownership role must selfstarter clear sense priorities handholding needed must willing able work solutions requires dig hard problems stay target solved issue robust way experience working asts ast transformations etc experience writing performant low gc code golang knowledge benchmark go code experience graphql api gateways proxies networking general plus experience openapi soap grpc graphql apollo federation plus opensource contributions benefit able work thrive fully remote environment excellent communicator important remote team english willing able travel occasionally meet team person least twice year join working meetings able work within cet time zone success looks like customers love product works flawlessly securely fast looks darn pretty developers love product exceptional dx said engineering company care lot dx teammates love work never let share knowledge ship like crazy team proper tests clean code prevent outages security issues grow along us wundergraph work wherever thrivewere fully remote globally distributed youre miami come work us person also provide coworking space options worldwide needed pick preferred work hardware focus getting stuff done fun whilst work hard play hard make real difference find lots opportunities grow together us discretionary pto take time need recharge competitive compensation depending location offer healthcare benefits according local standards team retreats across globe process respect time interest wundergraph aiming make process fast possible heres expect min intro call alex people team min technical background call one engineers following might receive small take home assignment programming task max h effort related open source platform chance prove skill complete assignment review together engineers meet founders culture fit call team members offer process also includes reference background checks aim respond provide feedback days stage process usually hiring deel employer record except germany florida hiring directly wundergraph equal opportunity workplace welcome people backgrounds keep us follow us linkedin github looking forward application grow together read apply httpswwwgolangprojectscomgolanggojobgmyremoteeuropeseniorgolangengineerremoteemeawundergraphremoteworkhtml",2,"2025-05-13 04:55:02","golangprojects"
"reddit","reddit","huisbaas betaalt eigenaarsdeel onderhoudskosten jr niet tussenpartij accepteert eenmalige aftrek niet hoi allemaal lastige situatie hier woon gehuurd eigenaar laat tussenpartij de huur innen pand heeft drie appartementen met gezamenlijk trapportaal huisbaas onderhoudt trapportaal al jaar niet hij weigert cvketel onderhoud al tien jaar drie lekkages worden niet verholpen er een verrot kozijn met een verzakte ruit waardoor het koud en lawaaiig de keuken en sinds kort lijkt de erker los te komen van mijn woonkamer als ik de kier langs de muur goed beoordeel die aan het groeien al die jaren antwoordt de tussenpartij noch de eigenaar op mijn verzoeken per mail en telefoon om reparaties en onderhoud afgelopen oktober heb ik kosten die ik zelf maakte voor het schilderen vd voordeur straatkant en trapportaal v mijn huurbetaling ingehouden de huur innende partij vroeg bewijzen ik heb ze een hele batterij fotos en videos vd lekkages en gebreken gestuurd al die tijd eisen ze betaling van het ingehouden huurdeel afgelopen week heb ik bouw en woningtoezicht een bericht gestuurd toen die contact opnam met de tussenpartij belde de eigenaar direct en kwam hij langs dat een goed gesprek hij heeft gevraagd om per app rechtstreeks mijn klachten per stuk aan hem te sturen met fotos erbij heb ik gedaan intussen blijft tussenpartij ontbrekende deel vd huur eisen met gebreke stelling als laatste mail wat moet ik nu doen aansturen op een rechtzaak dank voor jullie advies en kennis alvast",1,"2025-05-13 03:16:49","-horriblehorrible"
"reddit","reddit","cómo encontrar trabajo de programación sin experiencia primero metí investigar una gran variedad de plataformas de empleo recuerdo el nombre de todas facebook linkedin glassdoor indeed computrabajo occmundial freelancer upwork workana builtin toptal ycombinator hireline arc dev remotive remoteyeah opentoworkremote remotehub get board bewanted pro meritum cia de talentos etc de todas ellas te recomiendo buscar trabajo en las siguientes facebook linkedin computrabajo occmundial bewanted pro meritum cia de talentos arc dev toptal segundo si te gusta el trabajo presencial mínimo tendrás que aceptar híbrido de dias pues la tienes más difícil por la experiencia aunque siempre existe la posibilidad de encontrar remoto tercero el sueldo depende de si tienes inglés consigues entrar en una empresa extranjera que sería lo mejor porque si el salario que te van ofrecer sin experiencia va de k k en el mejor de los casos personalmente diría que aceptes menos de k porque es un abuso total cuarto práctica mucho hackerrank porque las entrevistas técnicas son de ese tipo al igual que te sugiero preparar preguntas típicas que te harían para las de rh fortalezas debilidades valores de la empresa etc quinto espero ya tengas los conocimientos que se usan en el campo laboral dependiendo tu área por ejemplo en desarrollo web html css js framework como react git al igual que algún proyecto importante para destacar ese conocimiento",12,"2025-05-13 01:47:37","skywhite7"
"reddit","reddit","hiring sales compensation analyst deel remote company date posted may apply description httpsjobboardsearchcomredirectutm_sourceredditutm_mediumbotutm_idjobboarsearchutm_termwwwcompensationjobscomrurlahrchmlydcuytcgvucfawuamicyjbvamicyzywxlcyjbwzwzyxrpbtywhbhlzdclmwqwmmuzoa",1,"2025-05-13 01:20:20","rrmdp"
"reddit","reddit","deel de peper en paprika planten de tuin",0,"2025-05-12 23:42:16","Pobies_Pepers"
"reddit","reddit","deel de peper en paprika planten de tuin",1,"2025-05-12 23:41:58","Pobies_Pepers"
"reddit","reddit","application visa nomad spain deel corporation hello im currently working client chile salary payments processed deel corporation company us contracts payslips deel corporation directly client gathering required documents apply spanish digital nomad visa asked provide two documents deel company registration certificate us letter authorizing work remotely spain contacted deel told provide documents hire visa application service anyone else situation knows proceed",1,"2025-05-12 23:36:42","Hungry-Bad155"
"reddit","reddit","ai onthult geheime pdfonderzoeksfunctie experts zijn sprakeloos chatgpts nieuwe pdfonderzoeksfunctie hier wat vinden jullie van deze aiontwikkeling deel je gedachten ai discussie httpsitinsightsnldigitaletransformatieaionthultgeheimepdfonderzoeksfunctieexpertszijnsprakeloos",1,"2025-05-12 23:30:29","itinsightsNL"
"reddit","reddit","hiring remote full remote jobs tech companies may job title company salary full remote senior marketing designerhttpsremotivecomremotejobsdesignseniormarketingdesigner nav inc usa senior product designerhttpsremotivecomremotejobsdesignseniorproductdesigner vanta usa deal desk managerhttpsremotivecomremotejobssalesbusinessdealdeskmanager mimica usa manager sales development smbhttpsremotivecomremotejobssalesbusinessmanagersalesdevelopmentsmb deel emea uk sales development representativehttpsremotivecomremotejobssalesbusinesssalesdevelopmentrepresentative sumo logic australia account executivehttpsremotivecomremotejobssalesbusinessaccountexecutive glaciergrid usa product managerhttpsremotivecomremotejobsproductproductmanager garner health usa senior product managerhttpsremotivecomremotejobsproductseniorproductmanager nearsure latam technical project managerhttpsremotivecomremotejobsprojectmanagementtechnicalprojectmanager averna asia vp implementationshttpsremotivecomremotejobsprojectmanagementvpimplementations sagent usa program managerhttpsremotivecomremotejobsprojectmanagementprogrammanager nearsource canada ecosystem project managerhttpsremotivecomremotejobsprojectmanagementecosystemprojectmanager openzeppelin worldwide senior video editorhttpsremotivecomremotejobsallothersseniorvideoeditor paired philippines audio designerhttpsremotivecomremotejobsallothersaudiodesigner ndreams limited uk",1,"2025-05-12 23:27:57","rdutel"
"reddit","reddit","flexjobs actually worth paying signed flexjobs earlier week ive job hunting remote work honestly linkedin indeed starting feel like black hole saw posts online saying flexjobs better legit listings figured id give shot paid oneweek trial like test waters site clean easy search surprised many jobs hadnt seen posted anywhere else found listings exactly niche marketing writing actually looked real vague titles weird sketchy links like ive run applied three jobs first two days already heard back one company shortterm contract gig dont think magic anything youre serious remote freelance work seem like focused place search said im still debating whether keep monthly subscription use short bursts want apply bunch anyone else used flexjobs year found something solid curious worth keeping longterm good quick job search boosts",1,"2025-05-12 23:00:21","cdheat21"
"reddit","reddit","anyways",12,"2025-05-12 22:53:28","Hunter8678"
"reddit","reddit","finding lovablespecific devs hi ive using lovable build pretty functional still limited front end sciencerelated tool budget project hoping find contractor two help finalize things build backend seems like looking developers experience react javascripttypescript suggestions best places look ive worked toptal find quite expensive thank advance",1,"2025-05-12 22:45:35","Guilty_Shock2491"
"reddit","reddit","nothin stopping grinding broken screen stoppin",7,"2025-05-12 22:34:16","GreenEducational998"
"reddit","reddit","shock dodelijke hack vernietigt je studentenaccount iclicker gehackt criminelen gebruiken nepcaptchas om malware te verspreiden wat vinden jullie van deze nieuwe tactiek hoe beschermen jullie je online deel je tips httpsitinsightsnlcybersecurityshockdodelijkehackvernietigtjestudentenaccount",1,"2025-05-12 22:01:48","itinsightsNL"
"reddit","reddit","ongelooflijke internet geheimen die michigan providers verbergen hebben jullie ooit de verborgen internetdeals michigan ontdekt deel je ervaringen en laten de beste providers samen vinden internettalk link httpsitinsightsnlhetlaatsteitnieuwsongelooflijkeinternetgeheimendiemichiganprovidersverbergen",1,"2025-05-12 22:00:41","itinsightsNL"
"reddit","reddit","schimmel op kardinaalsmuts al meer dan jaar hebben kardinaalsmuts de tuin staan deels de border als bodembedekker en deel wat hoger gegroeid en als haagje werkt sinds dit weekend valt ineens op dat er witte vlekjes op de bladeren zitten zowel voorin de tuin als ook bij de planten verderop verder op de andere planten zie ik niks de enige wijziging de tuin dat vorig jaar herfst tegels vervangen hebben voor gazon maar ook dat zon verwijderd van de eerste planten met deze witte schimmel help wat dit kan het kwaad hoe krikg ik het weg",3,"2025-05-12 21:47:41","Front-Ear-5653"
